ID;Active;Name;Categories;Price;Tax;"Wholesale price";OnSale;Discount;DiscountPercent;DiscountFrom;DiscountTo;Reference;SupplierReference;Supplier;Manufacturer;Ean13;Upc;Ecotax;Width;Height;Depth;Weight;Quantity;MinimalQuantity;Visibility;AdditionalShippingCost;Unity;UnityPrice;ShortDescription;Description;Tags;Metatitle;MetaKeywords;MetaDescription;UrlRewritten;TextStock;TextBackorder;Avaiable;ProductAvaiableDate;ProductCreationDate;ShowPrice;ImageUrls;DeleteExistingImages;Feature;AvaiableOnline;Condition;Customizable;Uploadable;TextFields;OutStock;IdNameShop;AdvancedStockManagement;DependsOnStock;Warehouse
48;1;"Coto de Imaz Tinto Gran Reserva 2010";2,3;"17,00 ";31;"17,00 ";0;0;0;0;0;10435;;;;;;;;;;;50;1;both;1;;;"Rioja + Gran Reserva + Cosecha Excelente + la maestría de un reputada bodega. Sobran argumentos para recomendar Coto de Imaz Gran Reserva 2010. Para apreciar una de las mejores añadas del siglo en un vino longevo, elegante y complejo.";"Información generalEn esta excelente añada, Coto de Imaz Gran Reserva 2010 simboliza la filosofía de El Coto de Rioja: búsqueda de la excelencia en la elaboración de vinos de alta calidad. Tras una selección de uvas de los mejores viñedos de la bodega, realizó la fermentación alcohólica durante un período de 21-30 días para pasar a barricas de roble francés y americano, donde llevó a cabo la fermentación maloláctica y posterior crianza durante un período mínimo de 24 meses. Finalmente, el vino reposó en los botelleros de la bodega durante un mínimo de 36 meses. Fundada en 1970 por un grupo de entusiastas con cierta experiencia en el sector, El Coto de Rioja pertenece hoy al Grupo Barón de Ley y vive sus mejores años como bodega de referencia en Rioja. Las instalaciones de El Coto de Rioja se encuentran entre las más espectaculares de toda la denominación de origen y cuentan con un total de 120.000 metros cuadrados. Sus vinos están presentes en más de 50 países. Coto de Imaz Gran Reserva 2010 (D.O.Ca. Rioja) maridará a la perfección con un solomillo de cerdo con salsa de frutos rojos y platos de casquería, como una manitas de cordero estofadas o hígado de cordero encebollado.";Coto-de-Imaz-Tinto-Gran-Reserva-2010;Coto-de-Imaz-Tinto-Gran-Reserva-2010;Coto-de-Imaz-Tinto-Gran-Reserva-2010;Coto-de-Imaz-Tinto-Gran-Reserva-2010;;;;1;;;1;http://www.vinoseleccion.com/media/catalog/product/cache/1/image/220x445/9df78eab33525d08d6e5fb8d27136e95/c/o/coto-de-imaz_1.png;;"Tipo de Vino: Blanco,Bodega: Pazo de Señorans,Regiones: D.O. Rías Baixas,Variedad de Uva: 100% Albariño,Enólogo: Ana I. Quintela Suárez,Bodeguero: Marisol Bueno y Javier Mareque,Tipo de botella: Troncocónica,Capacidad (cl): 75,Servicio: Degustar a una temperatura de 8º C,Graduación (% vol.): 13";1;new;0;0;0;0;0;0;0;0
49;1;"Marqués de Vargas Tinto Reserva 2008";2,3;"17,60 ";31;"17,60 ";0;0;0;0;0;10435;;;;;;;;;;;50;1;both;1;;;" ";"Información general Desde 1989, Pelayo de la Mata, actual Marqués de Vargas, cambió definitivamente el ritmo vitivinícola de su familia y apostó decididamente por la creación de una bodega en la que elaborar vinos de alta calidad. Se ponían así los cimientos del Grupo Vinícola Marqués de Vargas, propietario a día de hoy de las bodegas Pazo San Mauro (D.O. Rías Baixas) y Conde de San Cristóbal (D.O. Ribera del Duero). Pero fue allí, a las afueras de Logroño, en pleno corazón de Rioja, donde la bodega primigenia del grupo se alzó al estilo château, rodeada del viñedo. Desde el corazón del vino riojano les acercamos Marqués de Vargas Reserva 2008, un tinto vinificado con las uvas que crecen en la finca Pradolagar que domina esta bodega -una de las más tenaces de la región- y que sirve como perfecto estandarte de los mejores riojas. No dejen pasar la oportunidad de disfrutar de un Reserva que les sorprenderá por su elegancia y complejidad.";Marqués-de-Vargas-Tinto-Reserva-2008;Marqués-de-Vargas-Tinto-Reserva-2008;Marqués-de-Vargas-Tinto-Reserva-2008;Marqués-de-Vargas-Tinto-Reserva-2008;;;;1;;;1;http://www.vinoseleccion.com/media/catalog/product/cache/1/image/220x445/9df78eab33525d08d6e5fb8d27136e95/M/a/Marqu_s-de-Vargas-Reserva-2008-001_2.jpg;;"Tipo de Vino: Blanco,Bodega: Pazo de Señorans,Regiones: D.O. Rías Baixas,Variedad de Uva: 100% Albariño,Enólogo: Ana I. Quintela Suárez,Bodeguero: Marisol Bueno y Javier Mareque,Tipo de botella: Troncocónica,Capacidad (cl): 75,Servicio: Degustar a una temperatura de 8º C,Graduación (% vol.): 13";1;new;0;0;0;0;0;0;0;0
50;1;"Hinia 2011";2,3;"18,00 ";31;"18,00 ";0;0;0;0;0;10435;;;;;;;;;;;50;1;both;1;;;" ";"Información general Vendimia manual, selección de uvas, fermentación alcohólica en tinas de roble, maloláctica en barricas de roble francés nuevo, corta crianza posterior y largo periodo de reposo en botella, confieren a Hinia 2011 un carácter diferente.  Hinia es una propuesta muy recomendable de una de las bodegas con más larga tradición en Haro (la Rioja Alta). Un rioja de producción limitada (tan solo se han elaborado 5.800 botellas), concebido como varietal de tempranillo, uva estrella de Rioja, y que en esta cosecha 2011 (calificada como Excelente) alcanza altas cotas de calidad. Combinará a la perfección con platos de carnes rojas a la brasa o con chuletitas de cordero al sarmiento.
Con una trayectoria de 120 años, Martínez Lacuesta es una bodega referente en la elaboración de tintos de corte clásico. Con Hinia demuestra sus sólidas capacidades para transitar otros estilos.";Hinia-2011;Hinia-2011;Hinia-2011;Hinia-2011;;;;1;;;1;http://www.vinoseleccion.com/media/catalog/product/cache/1/image/220x445/9df78eab33525d08d6e5fb8d27136e95/H/i/Hinia-2011-001.jpg;;"Tipo de Vino: Blanco,Bodega: Pazo de Señorans,Regiones: D.O. Rías Baixas,Variedad de Uva: 100% Albariño,Enólogo: Ana I. Quintela Suárez,Bodeguero: Marisol Bueno y Javier Mareque,Tipo de botella: Troncocónica,Capacidad (cl): 75,Servicio: Degustar a una temperatura de 8º C,Graduación (% vol.): 13";1;new;0;0;0;0;0;0;0;0
51;1;"Barón de Ley Tinto Gran Reserva 2009";2,3;"18,25 ";31;"18,25 ";0;0;0;0;0;10435;;;;;;;;;;;50;1;both;1;;;"Los grandes reservas han representado históricamente la grandeza de Rioja. Vinos hechos para durar en el tiempo, maduros, suaves y muy placenteros de beber, como este sensacional Barón de Ley Gran Reserva 2009.";"Información generalLos grandes reservas riojanos viven hoy una nueva época dorada a juzgar por el interés que despiertan en el mercado internacional y las altas calificaciones que reciben en las guías más influyentes. Presentamos Barón de Ley Gran Reserva 2009, de la prestigiosa bodega Barón de Ley. Barón de Ley Gran Reserva 2009 está elaborado mayoritariamente con viñas de tempranillo cultivadas en Cenicero (Rioja Alta). Plantas que, debido a su orientación, bajos rendimientos y clima atlántico, otorgan uvas con buena acidez y concentración, perfectas para diseñar vinos longevos como éste.Bodegas Barón de Ley comienza su andadura en 1985. Una bodega a imagen de los ‘châteaux’ franceses, ya que instalaciones y viñedos se sitúan en la mima propiedad, en la finca Imas, situada en Mendavia, sobre la margen izquierda del río Ebro; un lugar idóneo para el cultivo de la vid. Especializada en la elaboración de reservas y grandes reservas de alta calidad, Barón de Ley es una de las referencias más importantes de la D.O.Ca. Rioja y una de las pocas bodegas españolas que cotiza en bolsa. Barón de Ley Gran Reserva armonizará con todo tipo de carnes, como un entrecot de buey o un secreto ibérico. También acompañará perfectamente cualquier postre a base de chocolate.";Barón-de-Ley-Tinto-Gran-Reserva-2009;Barón-de-Ley-Tinto-Gran-Reserva-2009;Barón-de-Ley-Tinto-Gran-Reserva-2009;Barón-de-Ley-Tinto-Gran-Reserva-2009;;;;1;;;1;http://www.vinoseleccion.com/media/catalog/product/cache/1/image/220x445/9df78eab33525d08d6e5fb8d27136e95/b/a/bar_n-de-ley-tinto-gran-reserva-001.jpg;;"Tipo de Vino: Blanco,Bodega: Pazo de Señorans,Regiones: D.O. Rías Baixas,Variedad de Uva: 100% Albariño,Enólogo: Ana I. Quintela Suárez,Bodeguero: Marisol Bueno y Javier Mareque,Tipo de botella: Troncocónica,Capacidad (cl): 75,Servicio: Degustar a una temperatura de 8º C,Graduación (% vol.): 13";1;new;0;0;0;0;0;0;0;0
52;1;"Barón de Ley Tinto Gran Reserva 2008";2,3;"18,50 ";31;"18,50 ";0;0;0;0;0;10435;;;;;;;;;;;50;1;both;1;;;"La tendencia del gusto vuelve a mirar hacia lo clásico; y los mercados internacionales muestran un renovado interés hacia los grandes reservas. Barón de Ley Gran Reserva 2008 es un clásico que representa la grandeza de Rioja.";"Información generalBarón de Ley Gran Reserva 2008 es un magnífico rioja concebido para perdurar en el tiempo por la reputada bodega Barón de Ley. Diseñado mayoritariamente con uvas tempranillo cultivadas en el término de Cenicero. Cepas que, debido a su orientación, a sus bajos rendimientos y al clima atlántico, otorgan frutos con buena acidez y concentración, perfectos para elaborar vinos longevos como éste.Bodegas Barón de Ley comienza su andadura en 1985. Una bodega a imagen de los ‘châteaux’ franceses, ya que instalaciones y viñedos se sitúan en la mima propiedad, en la finca Imas, situada en Mendavia, sobre la margen izquierda del río Ebro; un lugar idóneo para el cultivo de la vid. Especializada en la elaboración de reservas y grandes reservas de alta calidad, Barón de Ley es una de las referencias más importantes de la D.O.Ca. Rioja y una de las pocas bodegas españolas que cotiza en bolsa. Barón de Ley Gran Reserva será un excelente acompañante de unas chuletillas asadas de cordero lechal o un estofado de añojo con verduras y setas.";Barón-de-Ley-Tinto-Gran-Reserva-2008;Barón-de-Ley-Tinto-Gran-Reserva-2008;Barón-de-Ley-Tinto-Gran-Reserva-2008;Barón-de-Ley-Tinto-Gran-Reserva-2008;;;;1;;;1;http://www.vinoseleccion.com/media/catalog/product/cache/1/image/220x445/9df78eab33525d08d6e5fb8d27136e95/b/a/bar_n-de-ley-gran-reserva-2008-001.jpg;;"Tipo de Vino: Blanco,Bodega: Pazo de Señorans,Regiones: D.O. Rías Baixas,Variedad de Uva: 100% Albariño,Enólogo: Ana I. Quintela Suárez,Bodeguero: Marisol Bueno y Javier Mareque,Tipo de botella: Troncocónica,Capacidad (cl): 75,Servicio: Degustar a una temperatura de 8º C,Graduación (% vol.): 13";1;new;0;0;0;0;0;0;0;0
53;1;"Predicador 2013";2,3;"18,60 ";31;"18,60 ";0;0;0;0;0;10435;;;;;;;;;;;50;1;both;1;;;"El rioja revolucionario Contador (100 puntos Parker) catapultó a Benjamín Romeo a la gloria internacional. Predicador 2013 mantiene las señas de identidad de la bodega y de su vino estrella, pero con un precio al alcance de cualquier consumidor.";"Información generalBenjamín Romeo es uno de los grandes protagonistas de la revolución de los vinos de Rioja a mediados de los noventa. Con su tinto Contador logró todo un hito: ser valorado en dos añadas consecutivas con 100 puntos por el gurú Robert Parker, máximo reconocimiento internacional para un vino. Fruto de un rigor enológico escrupuloso, seña de identidad de la bodega, nace su hermano pequeño Predicador 2013.Predicador 2013 está diseñado con uvas seleccionadas de pequeños majuelos en San Vicente de la Sonsierra y Briones, enclave privilegiado de Rioja y cuna de grandes vinos, donde la noble tempranillo ofrece su mejor expresión. Para su elaboración se emplearon cepas de entre 20 y 35 años de edad, con muy poca producción, y recibió una crianza de 16 meses en roble francés. Perfecta simbiosis de fruta y roble, Predicador 2013 es un lujo accesible que no debería perderse.La historia de Bodegas Contador arrancó en 1995, en una pequeña bodega de garaje. Y era “de garaje” de forma literal, ya que sus primeros vinos fermentaban en un garaje, mientras que la crianza la realizaban en una cueva excavada en la ladera tradicionalmente usada para elaboración y crianza: la cueva del Contador. Tras salir de Artadi en 1999, donde ejerció de enólogo, Benjamín Romeo dedicó toda su atención a su proyecto personal.Gran conocedor de la zona, Benjamín Romeo fue haciéndose poco a poco con pequeños majuelos en los alrededores de San Vicente de Sonsierra, en las laderas de la Sierra de Toloño, que reunían altas exigencias de calidad: viñas viejas sobre suelos pobres, diferentes exposiciones y altitudes. En 2008 inauguró nueva y espectacular bodega en medio de los viñedos de San Vicente de la Sonsierra. El escrupuloso cuidado del viñedo explica la calidad de su gama de vinos, concebidos como reflejo del entorno y el terruño, como Predicador 2013.Perfecto para acompañar guisos de patatas con costillas de cerdo y platos de legumbres como unas verdinas con rabo de toro o unos garbanzos con callos.";Predicador-2013;Predicador-2013;Predicador-2013;Predicador-2013;;;;1;;;1;http://www.vinoseleccion.com/media/catalog/product/cache/1/image/220x445/9df78eab33525d08d6e5fb8d27136e95/p/r/predicador-2013-001.png;;"Tipo de Vino: Blanco,Bodega: Pazo de Señorans,Regiones: D.O. Rías Baixas,Variedad de Uva: 100% Albariño,Enólogo: Ana I. Quintela Suárez,Bodeguero: Marisol Bueno y Javier Mareque,Tipo de botella: Troncocónica,Capacidad (cl): 75,Servicio: Degustar a una temperatura de 8º C,Graduación (% vol.): 13";1;new;0;0;0;0;0;0;0;0
54;1;"Glorioso Tinto Gran Reserva 2006";2,3;"20,00 ";31;"20,00 ";0;0;0;0;0;10435;;;;;;;;;;;50;1;both;1;;;" ";"Información general Bodegas Palacio es una de las bodegas más importantes de la D.O.Ca. Rioja, elaboradora de los primeros vinos de autor y de clásicos renovados al gusto del consumidor, como la reconocida gama Glorioso que les presentamos.Glorioso Gran Reserva 2006 vuelve a poner de moda un tipo de vinos que están volviendo a conquistar el mercado tras unos años en los que parecían estar de capa caída. Un vino complejo y con todo el carácter riojano. Ahora ya pueden disfrutar de este monovarietal de tempranillo procedente de los viñedos más altos que posee la bodega en la zona de Rioja Alavesa, criado en algunas de las mejores barricas de roble francés que alberga la casa elaboradora.";Glorioso-Tinto-Gran-Reserva-2006;Glorioso-Tinto-Gran-Reserva-2006;Glorioso-Tinto-Gran-Reserva-2006;Glorioso-Tinto-Gran-Reserva-2006;;;;1;;;1;http://www.vinoseleccion.com/media/catalog/product/cache/1/image/220x445/9df78eab33525d08d6e5fb8d27136e95/G/l/Glorioso-Tinto-Gran-Reserva-2006-001_2.jpg;;"Tipo de Vino: Blanco,Bodega: Pazo de Señorans,Regiones: D.O. Rías Baixas,Variedad de Uva: 100% Albariño,Enólogo: Ana I. Quintela Suárez,Bodeguero: Marisol Bueno y Javier Mareque,Tipo de botella: Troncocónica,Capacidad (cl): 75,Servicio: Degustar a una temperatura de 8º C,Graduación (% vol.): 13";1;new;0;0;0;0;0;0;0;0
55;1;"Inspiración Valdemar Edición Limitada Tinto con crianza 2008";2,3;"21,00 ";31;"21,00 ";0;0;0;0;0;10435;;;;;;;;;;;50;1;both;1;;;"Bajo la marca Inspiración se concentran vinos nacidos de una exhaustiva selección de racimos que crecen en parcelas excepcionales, como Inspiración Valdemar Edición Limitada 2008.";"Información generalEstablecida desde 1889 en Rioja, Bodegas Valdemar es una de las firmas vitivinícolas más antiguas e importantes del territorio patrio. Su éxito reside en la perfecta combinación del saber hacer histórico mezclado con una constante investigación para tratar de buscar la máxima calidad en los vinos. Algunos ejemplos de ello se encuentran en la preselección de uvas en el viñedo propio, en ser pionera en el uso del control de temperaturas en la elaboración o en el vasto conocimiento de los largos períodos de crianza.Actualmente, Jesús Martínez Bujanda y sus hijos, Ana y Jesús, conforman la cuarta y quinta generación de esta sociedad bodeguera. Una saga que hogaño cuenta con las bodegas Fincas Valdemar, Valmoreda, Conde de Valdemar e Inspiración, ésta última protagonista de las selección que les proponemos.De aquí nace el tinto que les presentamos, Inspiración Valdemar Edición Limitada 2008, un perfecto ejemplo de esta constante investigación. No obstante, este vino con 18 meses de crianza en barricas de roble francés ha sido elaborado a partir de una selección de viñedos de tempranillo, maturana, graciano y otras castas de vid experimentales.";Inspiración-Valdemar-Edición-Limitada-Tinto-con-crianza-2008;Inspiración-Valdemar-Edición-Limitada-Tinto-con-crianza-2008;Inspiración-Valdemar-Edición-Limitada-Tinto-con-crianza-2008;Inspiración-Valdemar-Edición-Limitada-Tinto-con-crianza-2008;;;;1;;;1;http://www.vinoseleccion.com/media/catalog/product/cache/1/image/220x445/9df78eab33525d08d6e5fb8d27136e95/i/n/inspiraci_n-valdemar-edici_n-limitada-tinto-con-crianza-2008-001_1.jpg;;"Tipo de Vino: Blanco,Bodega: Pazo de Señorans,Regiones: D.O. Rías Baixas,Variedad de Uva: 100% Albariño,Enólogo: Ana I. Quintela Suárez,Bodeguero: Marisol Bueno y Javier Mareque,Tipo de botella: Troncocónica,Capacidad (cl): 75,Servicio: Degustar a una temperatura de 8º C,Graduación (% vol.): 13";1;new;0;0;0;0;0;0;0;0
56;1;"Viña Tondonia Blanco Reserva 2002";2,3;"21,30 ";31;"21,30 ";0;0;0;0;0;10435;;;;;;;;;;;50;1;both;1;;;"Viña Tondonia Blanco Reserva 2002 procede del viñedo más emblemático de la bodega R. López de Heredia Viña Tondonia, icono de clasicismo. De producción muy limitada.";"Información generalEn Rioja siempre se han elaborado blancos con crianza, vinos históricos aunque minoritarios, que en los últimos años han experimentado un nuevo resurgir. Una bodega amante de lo clásico como R. López de Heredia Viña Tondonia firma uno de los mejores del mercado: Viña Tondonia Blanco Reserva 2002. R. López de Heredia Viña Tondonia es una bodega familiar única en el mundo, con un modo de elaborar sin parangón e impermeable a las modas. Fundada 1877 en Haro, es la más antigua de este municipio reconocido como la capital de la Rioja Alta y corazón del vino riojano. Ahí se mantiene la familia López de Heredia elaborando en sus impresionantes instalaciones que recuerdan a las catedrales, con naves subterráneas en las que duermen durante años esos vinos finos y longevos que encarnan al clásico rioja, con un perfil muy diferenciado.Viña Tondonia es el viñedo más emblemático de R. López de Heredia Viña Tondonia, plantado por el bisabuelo de los actuales propietarios entre 1913 y1914, probablemente el viñedo más espectacular de Haro. 100 hectáreas ubicadas en la margen derecha del río Ebro donde se cultivan las uvas tradicionales riojanas, como las blancas viura y malvasía que dan vida a Viña Tondonia Blanco Reserva. Un vino elaborado artesanalmente y con una larguísima crianza en roble de 6 años, del que tan sólo se elaboran entre 10.000 y 15.000 al año.";Viña-Tondonia-Blanco-Reserva-2002;Viña-Tondonia-Blanco-Reserva-2002;Viña-Tondonia-Blanco-Reserva-2002;Viña-Tondonia-Blanco-Reserva-2002;;;;1;;;1;http://www.vinoseleccion.com/media/catalog/product/cache/1/image/220x445/9df78eab33525d08d6e5fb8d27136e95/v/i/vi_a-tondonia-blanco-reserva-2002-001.jpg;;"Tipo de Vino: Blanco,Bodega: Pazo de Señorans,Regiones: D.O. Rías Baixas,Variedad de Uva: 100% Albariño,Enólogo: Ana I. Quintela Suárez,Bodeguero: Marisol Bueno y Javier Mareque,Tipo de botella: Troncocónica,Capacidad (cl): 75,Servicio: Degustar a una temperatura de 8º C,Graduación (% vol.): 13";1;new;0;0;0;0;0;0;0;0
57;1;"Viña Tondonia Tinto Reserva 2004";2,3;"21,50 ";31;"21,50 ";0;0;0;0;0;10435;;;;;;;;;;;50;1;both;1;;;"Viña Tondonia Tinto Reserva es el vino más fino y más elegante de R. López de Heredia Viña Tondonia, icono de clasicismo. No se pierdan Viña Tondonia Tinto Reserva 2004 (cosecha Excelente). Máxima expresión de la filosofía una bodega única.";"Información generalViña Tondonia Reserva 2004 es un gran vino elaborado con paciencia. Diseñado con el viñedo más emblemático de la bodega R. López de Heredia Viña Tondonia, nace a partir de una cosecha que recibió la calificación de Excelente en la D.O.Ca. Rioja (la 2004), y está elaborado de manera artesanal: uvas seleccionadas, fermentación en tinos de madera, clarificado con claras de huevos frescos y con una larguísima crianza de 6 años en barricas de roble americano construidas en la propia tonelería de la bodega. Viña Tondonia Tinto Reserva es la máxima expresión de la filosofía R. López de Heredia Viña Tondonia: cuatro generaciones de la misma familia consagrada al propósito de conseguir obras maestras de artesanía y refinamiento, susceptibles de competir con los más famosos del mundo; un anhelo que el fundador de la bodega, Rafael López de Heredia y Landeta, definió, en el siglo XIX, como el ""Rioja Supremo"". Si hay una bodega que encarne el concepto del clasicismo riojano es sin duda R. López de Heredia Viña Tondonia. Una bodega única en el mundo, con un modo de elaborar sin parangón e impermeable a las modas. Fundada 1877 en Haro, es la más antigua de este municipio reconocido como la capital de La Rioja Alta y corazón del vino riojano. Ahí se mantiene la familia López Heredia elaborando en sus impresionantes instalaciones que recuerdan a las catedrales, con naves subterráneas en las que duermen durante años esos vinos finos y longevos que encarnan al clásico rioja, con un perfil muy diferenciado.";Viña-Tondonia-Tinto-Reserva-2004;Viña-Tondonia-Tinto-Reserva-2004;Viña-Tondonia-Tinto-Reserva-2004;Viña-Tondonia-Tinto-Reserva-2004;;;;1;;;1;http://www.vinoseleccion.com/media/catalog/product/cache/1/image/220x445/9df78eab33525d08d6e5fb8d27136e95/v/i/vi_a-tondonia-reserva-2004-001-001.jpg;;"Tipo de Vino: Blanco,Bodega: Pazo de Señorans,Regiones: D.O. Rías Baixas,Variedad de Uva: 100% Albariño,Enólogo: Ana I. Quintela Suárez,Bodeguero: Marisol Bueno y Javier Mareque,Tipo de botella: Troncocónica,Capacidad (cl): 75,Servicio: Degustar a una temperatura de 8º C,Graduación (% vol.): 13";1;new;0;0;0;0;0;0;0;0
58;1;"MC Marqués de Cáceres 2010";2,3;"22,50 ";31;"22,50 ";0;0;0;0;0;10435;;;;;;;;;;;50;1;both;1;;;" Bendecido por una de las cosechas más sobresalientes de los últimos años en Rioja, ";"Información general MC Marqués de Cáceres 2010 representa la cara más actual de esta emblemática firma. Un tinto nacido de una selección de las mejores parcelas de tempranillo que trabaja Marqués de Cáceres, elaborado en una añada calificada como Excelente.Marqués de Cáceres es una bodega relativamente joven que se ha hecho un hueco entre las grandísimas marcas de Rioja y del mundo. Ubicada en Cenicero, dentro de la prestigiosa subzona de la Rioja Alta, presume de ser una de las bodegas mejor posicionadas en el mercado internacional. Déjense seducir por MC Marqués de Cáceres 2010, un rioja de una personalidad rotunda, con una crianza de 15 meses en barricas de roble francés, pero  que se comercializa libre, sin calificativo en la contraetiqueta. De edición muy limitada y creado por una de las bodegas españolas más universales.";MC-Marqués-de-Cáceres-2010;MC-Marqués-de-Cáceres-2010;MC-Marqués-de-Cáceres-2010;MC-Marqués-de-Cáceres-2010;;;;1;;;1;http://www.vinoseleccion.com/media/catalog/product/cache/1/image/220x445/9df78eab33525d08d6e5fb8d27136e95/m/c/mc-marqu_s-de-c_ceres-2010-001.jpg;;"Tipo de Vino: Blanco,Bodega: Pazo de Señorans,Regiones: D.O. Rías Baixas,Variedad de Uva: 100% Albariño,Enólogo: Ana I. Quintela Suárez,Bodeguero: Marisol Bueno y Javier Mareque,Tipo de botella: Troncocónica,Capacidad (cl): 75,Servicio: Degustar a una temperatura de 8º C,Graduación (% vol.): 13";1;new;0;0;0;0;0;0;0;0
59;1;"La Rioja Alta Tinto Gran Reserva 2001";2,3;"23,65 ";31;"23,65 ";0;0;0;0;0;10435;;;;;;;;;;;50;1;both;1;;;" La Rioja Alta ha pasado a la historia como uno de los emblemas del clasicismo riojano mejor entendido. Muestra de ello es este exquisito ";"Información general No todos los años las mejores bodegas sacan grandes reservas. Sólo cuando la naturaleza es generosa y se obtienen uvas con buena acidez que aguanten el paso del tiempo. Esto sucedió en 2001, una añada histórica en Rioja. La Rioja Alta Gran Reserva 2001 es un tinto exclusivo para el Club elaborado con tempranillo, uva reina de esta región, complementada con un toque de graciano.Desde su centro de operaciones en el célebre Barrio de la Estación de Haro, considerado el corazón del vino español, La Rioja Alta S.A. se alza desde hace más de un siglo como emblema de la máxima calidad, firmando algunos de los riojas más laureados de la historia, como Viña Ardanza.Una casa que ha sabido evolucionar de forma excelente con el tiempo, introduciendo pequeños cambios pero sin rupturas, para llegar a nuestros días como una de las empresas vitivinícolas más prestigiosas y activas del territorio nacional.";La-Rioja-Alta-Tinto-Gran-Reserva-2001;La-Rioja-Alta-Tinto-Gran-Reserva-2001;La-Rioja-Alta-Tinto-Gran-Reserva-2001;La-Rioja-Alta-Tinto-Gran-Reserva-2001;;;;1;;;1;http://www.vinoseleccion.com/media/catalog/product/cache/1/image/220x445/9df78eab33525d08d6e5fb8d27136e95/L/a/La-Rioja-Alta-Tinto-Gran-Reserva-2001-001_2.jpg;;"Tipo de Vino: Blanco,Bodega: Pazo de Señorans,Regiones: D.O. Rías Baixas,Variedad de Uva: 100% Albariño,Enólogo: Ana I. Quintela Suárez,Bodeguero: Marisol Bueno y Javier Mareque,Tipo de botella: Troncocónica,Capacidad (cl): 75,Servicio: Degustar a una temperatura de 8º C,Graduación (% vol.): 13";1;new;0;0;0;0;0;0;0;0
