ID;Active;Name;Categories;Price;Tax;"Wholesale price";OnSale;Discount;DiscountPercent;DiscountFrom;DiscountTo;Reference;SupplierReference;Supplier;Manufacturer;Ean13;Upc;Ecotax;Width;Height;Depth;Weight;Quantity;MinimalQuantity;Visibility;AdditionalShippingCost;Unity;UnityPrice;ShortDescription;Description;Tags;Metatitle;MetaKeywords;MetaDescription;UrlRewritten;TextStock;TextBackorder;Avaiable;ProductAvaiableDate;ProductCreationDate;ShowPrice;ImageUrls;DeleteExistingImages;Feature;AvaiableOnline;Condition;Customizable;Uploadable;TextFields;OutStock;IdNameShop;AdvancedStockManagement;DependsOnStock;Warehouse
1;1;"Marqués de Cáceres Rosado 2015";2,3;"5,50 ";31;"5,50 ";0;0;0;0;0;10435;;;;;;;;;;;50;1;both;1;;;"Marqués de Cáceres Rosado 2015 tiene todos los atributos de un buen rosado: nariz intensa y compleja, frescura y sabores frutales, además de cierta amplitud.";"Información generalLos rosados han vuelto a ocupar el puesto que se merecen, a ser apreciados y demandados. Y es que el nivel de su calidad ha aumentado en los últimos años. Y no podía ser menos en Rioja, donde existe también una larga tradicional en rosados. Aquí, una de las bodegas más prestigiosas presenta su propuesta en rosa: Marqués de Cáceres Rosado 2015.Marqués de Cáceres está entre las grandísimas marcas de Rioja y del mundo. La bodega, fundada en 1970, fue pionera en la renovación de los vinos riojanos, introduciendo técnicas como el uso de barricas nuevas en lugar de barricas viejas, y roble francés en lugar del tradicional roble americano. Una bodega grande, con una excepcional proyección internacional (sus vinos llegan a más de 130 países), capaz de elaborar vinos tan cuidados y selectos como una bodega artesanal. Marqués de Cáceres Rosado 2015 está hecho principalmente con tempranillo (uva emblema de Rioja) de parcelas seleccionadas ubicadas en las zonas más frescas de Cenicero y Rioja Alavesa y vendimiadas de forma manual. Para amantes de los vinos afrutados. Ideal en los aperitivos: charcutería, quesos y patés. En la comida maridará a la perfección con arroces, pastas, paellas mixtas, pescados al horno y carnes blancas como pollo a la naranja.";Marqués-de-Cáceres-Rosado-2015;Marqués-de-Cáceres-Rosado-2015;Marqués-de-Cáceres-Rosado-2015;Marqués-de-Cáceres-Rosado-2015;;;;1;;;1;http://www.vinoseleccion.com/media/catalog/product/cache/1/image/220x445/9df78eab33525d08d6e5fb8d27136e95/m/a/marques-de-caceres-rosado-2015-001.jpg;;"Tipo de Vino: Blanco,Bodega: Pazo de Señorans,Regiones: D.O. Rías Baixas,Variedad de Uva: 100% Albariño,Enólogo: Ana I. Quintela Suárez,Bodeguero: Marisol Bueno y Javier Mareque,Tipo de botella: Troncocónica,Capacidad (cl): 75,Servicio: Degustar a una temperatura de 8º C,Graduación (% vol.): 13";1;new;0;0;0;0;0;0;0;0
2;1;"Lorea Blanco 2014";2,3;"6,75 ";31;"6,75 ";0;0;0;0;0;10435;;;;;;;;;;;50;1;both;1;;;"No se pierdan Lorea 2014, un monovarietal de viura, uva emblemática de los blancos riojanos. Elegante, delicado, sutil y exclusivo, está diseñado por CVNE para conmemorar el centenario del lanzamiento de su marca Monopole.";"Información generalAunque son los tintos los vinos más aclamados de la D.O.Ca. Rioja, en esta región también se han elaborado históricamente blancos de calidad como complemento perfecto. La viura es la uva protagonista de los blancos riojanos, como en este Lorea 2014, de edición limitada. La Compañía Vinícola del Norte de España (CVNE) es una de las grandes firmas de Rioja y un ejemplo para el sector del vino internacional. Desde sus comienzos, en las últimas décadas del siglo XIX, esta casa ha buscado en sus productos la diferenciación y hoy en día puede presumir de haber llevado a lo más alto el buen nombre del vino español. Como ejemplo, su Imperial Gran Reserva 2004 fue elegido “Mejor Vino del Mundo” por la influyente revista estadounidense Wine Spectator en 2013. En 2015 CVNE celebra el centenario del lanzamiento de uno de sus vinos más célebres: Monopole. Para conmemorarlo, ha creado una edición limitada y exclusiva con etiquetas diseñadas por el prestigioso pintor Eduardo Arroyo, a la que pertenece este Lorea 2014. Ideal para disfrutar con un lenguado con salsa de gam¬bas o con un arroz caldoso con berberechos y chirlas.";Lorea-Blanco-2014;Lorea-Blanco-2014;Lorea-Blanco-2014;Lorea-Blanco-2014;;;;1;;;1;http://www.vinoseleccion.com/media/catalog/product/cache/1/image/220x445/9df78eab33525d08d6e5fb8d27136e95/l/o/lorea-blanco-2014-001.jpg;;"Tipo de Vino: Blanco,Bodega: Pazo de Señorans,Regiones: D.O. Rías Baixas,Variedad de Uva: 100% Albariño,Enólogo: Ana I. Quintela Suárez,Bodeguero: Marisol Bueno y Javier Mareque,Tipo de botella: Troncocónica,Capacidad (cl): 75,Servicio: Degustar a una temperatura de 8º C,Graduación (% vol.): 13";1;new;0;0;0;0;0;0;0;0
3;1;"Muga Rosado 2015 ";2,3;"7,00 ";31;"7,00 ";0;0;0;0;0;10435;;;;;;;;;;;50;1;both;1;;;"Muga Rosado 2015 es fresco y frutal, pero también serio y equilibrado. Un vino de impecable factura elaborado por una de las bodegas más sólidas y emblemáticas de Rioja. No se lo pierdan.";"Información generalAro, Prado Enea o Torre Muga están entre los mejores tintos de este país. Menos conocida para el gran público es la excelente labor que lleva a cabo la familia Muga a la hora de elaborar su rosado, uno de los mejores que se pueden encontrar en la D.O.Ca. Rioja: Muga Rosado 2015.Muga Rosado 2015 está elaborado principalmente con uvas de la variedad garnacha. Mientras que la bodega Muga emplea para los tintos las garnachas cultivadas en las laderas de los montes Obarenes, con una buena maduración de los frutos por la exposición al sol, para el rosado utiliza los racimos de garnacha de la ladera contraria, donde una menor insolación permite mejor frescor y conservar las notas a fruta ácida y fresca, características de este vino.Muga (1932) es una de las bodegas más sólidas y emblemáticas de Rioja. Desde el Barrio de la Estación de Haro, la última generación de una ilustre saga familiar continúa elaborando una gama de vinos que destacan por su calidad, fruto del exhaustivo trabajo llevado a cabo tanto en el viñedo como en la bodega y de la minuciosa selección de barricas de roble procedentes de los mejores bosques europeos y norteamericanos. Además, es una de las poquísimas bodegas españolas que cuentan con tonelería para fabricar sus propias barricas. Este Muga Rosado 2015 es ideal para acompañar cocina oriental, platos de pasta, pollo asado y huevos rotos con jamón.";Muga-Rosado-2015-;Muga-Rosado-2015-;Muga-Rosado-2015-;Muga-Rosado-2015-;;;;1;;;1;http://www.vinoseleccion.com/media/catalog/product/cache/1/image/220x445/9df78eab33525d08d6e5fb8d27136e95/m/u/muga-rosado-2015-001-1.jpg;;"Tipo de Vino: Blanco,Bodega: Pazo de Señorans,Regiones: D.O. Rías Baixas,Variedad de Uva: 100% Albariño,Enólogo: Ana I. Quintela Suárez,Bodeguero: Marisol Bueno y Javier Mareque,Tipo de botella: Troncocónica,Capacidad (cl): 75,Servicio: Degustar a una temperatura de 8º C,Graduación (% vol.): 13";1;new;0;0;0;0;0;0;0;0
4;1;"Lorea Tinto Crianza 2012";2,3;"7,30 ";31;"7,30 ";0;0;0;0;0;10435;;;;;;;;;;;50;1;both;1;;;"Lorea Crianza 2012 es un tinto riojano diseñado en exclusiva para el Club por la prestigiosa bodega CVNE. Ejemplo de equilibrio entre las notas frutales y las aportadas por una magnífica crianza en madera.";"Información generalLorea Crianza 2012 forma parte de una serie limitada de CVNE creada para celebrar el centenario del lanzamiento de su célebre vino Monopole. Lorea Crianza 2012 está diseñado con las uvas tempranillo (mayoritaria), garnacha y mazuelo, y recibió una crianza de 12 meses en roble americano. Además, luce una etiqueta especial diseñada por el prestigioso pintor Eduardo Arroyo. La Compañía Vinícola del Norte de España – CVNE (1879) es una de las bodegas pioneras en la elaboración y embotellado de vinos riojanos y una de las grandes firmas del panorama vinícola español. Situada en el histórico Barrio de la Estación de Haro, corazón del vino riojano, CVNE ha buscado desde sus comienzos la diferenciación y hoy en día presume de haber llevado a lo más alto el buen nombre del vino español. Como ejemplo, su Imperial Gran Reserva 2004 fue elegido “Mejor Vino del Mundo” por la influyente revista estadounidense Wine Spectator en 2013.";Lorea-Tinto-Crianza-2012;Lorea-Tinto-Crianza-2012;Lorea-Tinto-Crianza-2012;Lorea-Tinto-Crianza-2012;;;;1;;;1;http://www.vinoseleccion.com/media/catalog/product/cache/1/image/220x445/9df78eab33525d08d6e5fb8d27136e95/l/o/lorea-crianza-2012-001.jpg;;"Tipo de Vino: Blanco,Bodega: Pazo de Señorans,Regiones: D.O. Rías Baixas,Variedad de Uva: 100% Albariño,Enólogo: Ana I. Quintela Suárez,Bodeguero: Marisol Bueno y Javier Mareque,Tipo de botella: Troncocónica,Capacidad (cl): 75,Servicio: Degustar a una temperatura de 8º C,Graduación (% vol.): 13";1;new;0;0;0;0;0;0;0;0
5;1;"Monte Real de Familia Tinto Reserva 2010";2,3;"8,00 ";31;"8,00 ";0;0;0;0;0;10435;;;;;;;;;;;50;1;both;1;;;"Monte Real de Familia Reserva 2010 es un tinto elaborado, en exclusiva, para los socios del Club en esta importante efeméride.";"Información generalInstituida en 1890 por la familia Artacho y Rafael Carreras, Bodegas Riojanas es una de las empresas vitivinícolas con más tradición y trayectoria en el sector nacional. Una firma reconocida internacionalmente, que puede presumir de pertenecer al reducido grupo de bodegas centenarias españolas y de ser una excelente embajadora de nuestra denominación de origen más internacional.Establecida originalmente en Cenicero, en plena Rioja Alta, la bodega ha vivido diversas modernizaciones a lo largo de su singladura, hasta la construcción de otra casa elaboradora en el municipio de San Vicente de la Sonsierra, también en la subzona de Rioja Alta. Actualmente, el inmueble de elaboración de Bodegas Riojanas cuenta con los últimos avances en tecnología de producción y está dotado de un parque de barricas que ronda las 30.000 unidades.Desde allí les proponemos Monte Real de Familia Reserva 2010, un tinto elaborado en exclusiva para los socios de Vinoselección. El pasado año, esta legendaria casa elaboradora cumplió 125 años y, por ello, Vinoselección ha querido compartir con sus socios esta magnífica efeméride, comenzando el año de celebración.";Monte-Real-de-Familia-Tinto-Reserva-2010;Monte-Real-de-Familia-Tinto-Reserva-2010;Monte-Real-de-Familia-Tinto-Reserva-2010;Monte-Real-de-Familia-Tinto-Reserva-2010;;;;1;;;1;http://www.vinoseleccion.com/media/catalog/product/cache/1/image/220x445/9df78eab33525d08d6e5fb8d27136e95/m/o/monte-real-2010_2_1.jpg;;"Tipo de Vino: Blanco,Bodega: Pazo de Señorans,Regiones: D.O. Rías Baixas,Variedad de Uva: 100% Albariño,Enólogo: Ana I. Quintela Suárez,Bodeguero: Marisol Bueno y Javier Mareque,Tipo de botella: Troncocónica,Capacidad (cl): 75,Servicio: Degustar a una temperatura de 8º C,Graduación (% vol.): 13";1;new;0;0;0;0;0;0;0;0
6;1;"Marqués de Villamagna Tinto Reserva 2010";2,3;"8,00 ";31;"8,00 ";0;0;0;0;0;10435;;;;;;;;;;;50;1;both;1;;;"La añada 2010 ha sido en Rioja una de las mejores del siglo. Con ella se elaboran tintos excepcionales como Marqués de Villamagna Reserva 2010, embajador de los grandes riojas.";"Información generalMarqués de Villamagna Reserva 2010 es un rioja reserva de cosecha Excelente, diseñado con la uva protagonista de la D.O.Ca. Rioja: la tempranillo, acompañada por un toque de graciano y mazuelo, y envejecido más de dos años en barricas de roble francés y americano. Bodegas Juan Alcorta es una de las firmas más prestigiosas del grupo Pernod Ricard, líder en la elaboración, comercialización y exportación de vinos de calidad españoles, y propietario de otras firmas como Bodegas Ysios y Azpilicueta. Juan Alcorta cuenta con las instalaciones más espectaculares del grupo. En su interior se elabora una extensa gama de vinos que respetan el estilo clásico de Rioja, como Marqués de Villamagna.De hecho, algunos de los procesos de vinificación que se emplean en Juan Alcorta son recuperados de la tradición, como el movimiento de la uva por gravedad y la excavación de la bodega para buscar unas condiciones óptimas para la elaboración y crianza. Juan Alcorta dispone de 70.000 barricas y está dedicada, en exclusiva, a los vinos de Crianza, Reserva y Gran Reserva. Además, cuenta con una de las enólogas más relevantes del país: Elena Adell, que firma este Marqués de Villamagna Reserva 2010.";Marqués-de-Villamagna-Tinto-Reserva-2010;Marqués-de-Villamagna-Tinto-Reserva-2010;Marqués-de-Villamagna-Tinto-Reserva-2010;Marqués-de-Villamagna-Tinto-Reserva-2010;;;;1;;;1;http://www.vinoseleccion.com/media/catalog/product/cache/1/image/220x445/9df78eab33525d08d6e5fb8d27136e95/m/a/marqu_s-de-villamagna-tinto-reserva-2010-001.jpg;;"Tipo de Vino: Blanco,Bodega: Pazo de Señorans,Regiones: D.O. Rías Baixas,Variedad de Uva: 100% Albariño,Enólogo: Ana I. Quintela Suárez,Bodeguero: Marisol Bueno y Javier Mareque,Tipo de botella: Troncocónica,Capacidad (cl): 75,Servicio: Degustar a una temperatura de 8º C,Graduación (% vol.): 13";1;new;0;0;0;0;0;0;0;0
7;1;"Valserrano Tinto Crianza 2012";2,3;"8,10 ";31;"8,10 ";0;0;0;0;0;10435;;;;;;;;;;;50;1;both;1;;;"Valserrano Crianza 2012 es un rioja moderno y de producción limitada, respetuoso con los valores que le hicieron famoso hace más de un siglo. A un precio sensacional.";"Información generalViñedos y Bodegas de La Marquesa es una de las bodegas con más solera de Rioja Alavesa, cuyos orígenes se remontan a 1880. Un magnífico ejemplo de bodega familiar en la que conviven la tradición (presente en los calados subterráneos centenarios) y la más puntera tecnología al servicio de la enología. De esta emblemática bodega presentamos Valserrano Crianza 2012.Viñedos y Bodegas de La Marquesa (1880) fue fundada por Francisco Javier Solano y Eulate “Marqués de la Solana” en Villabuena de Álava. Francisco Javier Solano y Eulate poseía una buena extensión de viñedos en Rioja Alavesa, y asesorado por el célebre enólogo francés Pineau, decidió elaborar vinos de calidad con sus frutos siguiendo los métodos del Medoc. Rápidamente, sus vinos comenzaron a cosechar reconocimientos internacionales.Viñedos y Bodegas de La Marquesa continúa en manos de la familia fundadora, representada por la cuarta y quinta generación. Cuenta con 65 hectáreas de viñedos propios a escasa distancia de la bodega, en el municipio de Villabuena, en laderas que descienden desde la Sierra de Cantabria hacia el río Ebro, con una edad media superior a los 30 años. Con estos viñedos elabora Valserrano Crianza 2012, un rioja de corte moderno y de producción limitada, perfeccionado con una crianza de 18 meses en barricas.";Valserrano-Tinto-Crianza-2012;Valserrano-Tinto-Crianza-2012;Valserrano-Tinto-Crianza-2012;Valserrano-Tinto-Crianza-2012;;;;1;;;1;http://www.vinoseleccion.com/media/catalog/product/cache/1/image/220x445/9df78eab33525d08d6e5fb8d27136e95/v/a/valserrano-2012.jpg;;"Tipo de Vino: Blanco,Bodega: Pazo de Señorans,Regiones: D.O. Rías Baixas,Variedad de Uva: 100% Albariño,Enólogo: Ana I. Quintela Suárez,Bodeguero: Marisol Bueno y Javier Mareque,Tipo de botella: Troncocónica,Capacidad (cl): 75,Servicio: Degustar a una temperatura de 8º C,Graduación (% vol.): 13";1;new;0;0;0;0;0;0;0;0
8;1;"Finca La Emperatriz Edición Limitada Tinto Reserva 2011";2,3;"8,15 ";31;"8,15 ";0;0;0;0;0;10435;;;;;;;;;;;50;1;both;1;;;"Bodegas La Emperatriz es una de las nuevas estrellas del vino riojano. Recomendamos su Finca La Emperatriz Edición Limitada Reserva 2011, un gran vino de finca, nacido de viñedos viejos y de cosecha Excelente.";"Información generalBodegas La Emperatriz es un proyecto vitivinícola creado hace dos décadas por los hermanos Eduardo y Víctor Hernáiz que, a una velocidad vertiginosa, se ha posicionado como uno de los valores más destacados del panorama del vino nacional. Este exquisito Finca La Emperatriz Edición Limitada Reserva 2011 es una de sus últimas creaciones.  Calificada como Excelente, la cosecha 2011 pasará a la historia como una de las mejores en la D.O.Ca. Rioja. De esta añada nace Finca La Emperatriz Edición Limitada Reserva 2011, un magnífico tinto resultado de la meticulosa parcelación de una finca privilegiado, la Finca La Emperatriz. Bodegas La Emperatriz debe su nombre a Eugenia de Montijo, esposa de Napoleón III y Emperatriz de Francia, poseedora de una finca en Rioja con viñedos excepcionales (en 1878 Eugenia de Montijo fue premiada en la Exposición Universal de París al conquistar al jurado con un vino elaborado en esta finca). En 1996 los hermanos Eduardo y Víctor Hernáiz adquirieron la propiedad, y así comienza a escribirse la historia moderna de Bodegas La Emperatriz.  Su principal baza es la histórica Finca La Emperatriz, situada en Baños de Rioja, entre las sierras de La Demanda y Cantabria, con 101 hectáreas de viñedo que ha sido parcelado con precisión para dar mayor personalidad a cada una de las variedades cultivadas. Una vez en bodega, los hermanos Hernáiz apuestan por una enología de vanguardia y respetuosa con el ‘terroir’. Este Finca La Emperatriz Edición Limitada Reserva es una edición especial de la nueva añada de Finca La Emperatriz Reserva, un gran vino que en su cosecha 2010 recibió 93 puntos Parker.";Finca-La-Emperatriz-Edición-Limitada-Tinto-Reserva-2011;Finca-La-Emperatriz-Edición-Limitada-Tinto-Reserva-2011;Finca-La-Emperatriz-Edición-Limitada-Tinto-Reserva-2011;Finca-La-Emperatriz-Edición-Limitada-Tinto-Reserva-2011;;;;1;;;1;http://www.vinoseleccion.com/media/catalog/product/cache/1/image/220x445/9df78eab33525d08d6e5fb8d27136e95/f/i/finca-la-emperatriz-edici_n-limitada-reserva-2011-001.jpg;;"Tipo de Vino: Blanco,Bodega: Pazo de Señorans,Regiones: D.O. Rías Baixas,Variedad de Uva: 100% Albariño,Enólogo: Ana I. Quintela Suárez,Bodeguero: Marisol Bueno y Javier Mareque,Tipo de botella: Troncocónica,Capacidad (cl): 75,Servicio: Degustar a una temperatura de 8º C,Graduación (% vol.): 13";1;new;0;0;0;0;0;0;0;0
9;1;"Marqués de Vitoria Selección de Familia Tinto Reserva 2009 ";2,3;"8,50 ";31;"8,50 ";0;0;0;0;0;10435;;;;;;;;;;;50;1;both;1;;;"Marqués de Vitoria Selección de Familia Reserva 2009 es un magnífico y exclusivo tinto diseñado con los frutos de tempranillo procedentes de una de las mejores zonas de la D.O.Ca. Rioja.";"Información generalMarqués de Vitoria Selección de Familia Reserva 2009 está elaborado en la subzona de Rioja Alavesa a partir de viñedos cultivados según los criterios de la viticultura ecológica. Su crianza de 18 meses en barricas de roble francés le aporta elegancia y complejidad.  Marqués de Vitoria Reserva 2009 consiguió la Medalla de Plata en el Concurso Mundial de Bruselas 2015 y un Bacchus de Plata en los premios que concede anualmente la Unión Española de Catadores (UEC). Este Reserva Selección de Familia es una edición exclusiva para el Club. Marqués de Vitoria representa como nadie el carácter de la Rioja Alavesa. La Rioja Alavesa produce tintos con nervio, con carácter, que rinden culto al magnífico terruño del que proceden. Una tierra protegida por la imponente Sierra de Cantabria que goza de un microclima privilegiado y una tradición elaboradora que se remonta a la época de los romanos. La prestigiosa Marqués de Vitoria es propiedad del Grupo Faustino.";Marqués-de-Vitoria-Selección-de-Familia-Tinto-Reserva-2009-;Marqués-de-Vitoria-Selección-de-Familia-Tinto-Reserva-2009-;Marqués-de-Vitoria-Selección-de-Familia-Tinto-Reserva-2009-;Marqués-de-Vitoria-Selección-de-Familia-Tinto-Reserva-2009-;;;;1;;;1;http://www.vinoseleccion.com/media/catalog/product/cache/1/image/220x445/9df78eab33525d08d6e5fb8d27136e95/m/a/marqu_s-de-vitoria-selecci_n-de-familia-tinto-reserva-2009-001.jpg;;"Tipo de Vino: Blanco,Bodega: Pazo de Señorans,Regiones: D.O. Rías Baixas,Variedad de Uva: 100% Albariño,Enólogo: Ana I. Quintela Suárez,Bodeguero: Marisol Bueno y Javier Mareque,Tipo de botella: Troncocónica,Capacidad (cl): 75,Servicio: Degustar a una temperatura de 8º C,Graduación (% vol.): 13";1;new;0;0;0;0;0;0;0;0
10;1;"Glorioso Tinto Reserva 2010";2,3;"8,60 ";31;"8,60 ";0;0;0;0;0;10435;;;;;;;;;;;50;1;both;1;;;"Bodegas Palacio es una firma centenaria que ha contribuido a la revolución del vino riojano. Presentamos uno de sus reservas más legendarios: Glorioso Reserva 2010, de añada Excelente.";"Información generalGlorioso Reserva 2010 (cosecha Excelente) es uno los más sobresalientes reservas riojanos. Está diseñado únicamente con uva tempranillo, la estrella del viñedo riojano. Una larga crianza en barricas de roble de 24 meses (periodo que supera ampliamente los tiempos reglamentados por el Consejo Regulador de la D.O.Ca. Rioja) perfeccionó un tinto cuya marca ya forma parte de la leyenda del vino español, con más de 85 años en el mercado.Fundada en 1894, Bodegas Palacio tiene su base de operaciones en una de las zonas más privilegiadas de Rioja Alavesa: el término de Laguardia, y es una de las bodegas más importantes y con más historia de la D.O.Ca. Rioja.Bodegas Palacio fue pionera en la pasada década de los ochenta en aplicar nuevos métodos de elaboración que provocarían la modernización del vino riojano. Con la colaboración del reconocido enólogo francés Michel Rolland, elaboró los primeros vinos de autor de Rioja en los noventa (su etiqueta Cosme Palacio). Entre sus tesoros se encuentra también Glorioso, marca que vio la luz por primera vez en 1928, y que desde entonces mantiene una magnífica regularidad.";Glorioso-Tinto-Reserva-2010;Glorioso-Tinto-Reserva-2010;Glorioso-Tinto-Reserva-2010;Glorioso-Tinto-Reserva-2010;;;;1;;;1;http://www.vinoseleccion.com/media/catalog/product/cache/1/image/220x445/9df78eab33525d08d6e5fb8d27136e95/g/l/glorioso-tinto-reserva-2010-001_1.jpg;;"Tipo de Vino: Blanco,Bodega: Pazo de Señorans,Regiones: D.O. Rías Baixas,Variedad de Uva: 100% Albariño,Enólogo: Ana I. Quintela Suárez,Bodeguero: Marisol Bueno y Javier Mareque,Tipo de botella: Troncocónica,Capacidad (cl): 75,Servicio: Degustar a una temperatura de 8º C,Graduación (% vol.): 13";1;new;0;0;0;0;0;0;0;0
11;1;"Glorioso Tinto Reserva 2009";2,3;"8,90 ";31;"8,90 ";0;0;0;0;0;10435;;;;;;;;;;;50;1;both;1;;;" Desde 1928 Glorioso se erige como un imprescindible del vino riojano. Un tinto con identidad propia, de perfil elegante y clásico. Presentamos ";"Información generalGlorioso Reserva 2009 es un verdadero embajador de la rioja tradicional, valorado con 92 puntos en la Guía Peñín y ganador de la Medalla de Oro en el Concurso Mundial de Bruselas 2014. Este Glorioso se elaboró con uvas seleccionadas de tempranillo cultivadas en Rioja Alavesa, y supera ampliamente los tiempos de crianza impuestos por el Consejo Regulador riojano, con 20 meses de estancia en roble. Fundada en 1894, Bodegas Palacio tiene su base de operaciones en una de las zonas más privilegiadas de Rioja Alavesa: el término de Laguardia, y es una de las bodegas más importantes y con más historia de la D.O.Ca. Rioja.Bodegas Palacio fue pionera en la pasada década de los ochenta en aplicar nuevos métodos de elaboración que provocarían la modernización del vino riojano. Con la colaboración del reconocido enólogo francés Michel Rolland, elaboró los primeros vinos de autor de Rioja en los noventa (su etiqueta Cosme Palacio). Entre sus tesoros se encuentra también Glorioso, marca que vio la luz por primera vez en 1928, y que desde entonces mantiene una magnífica regularidad.";Glorioso-Tinto-Reserva-2009;Glorioso-Tinto-Reserva-2009;Glorioso-Tinto-Reserva-2009;Glorioso-Tinto-Reserva-2009;;;;1;;;1;http://www.vinoseleccion.com/media/catalog/product/cache/1/image/220x445/9df78eab33525d08d6e5fb8d27136e95/g/l/glorioso-tinto-reserva-2009-001_2.jpg;;"Tipo de Vino: Blanco,Bodega: Pazo de Señorans,Regiones: D.O. Rías Baixas,Variedad de Uva: 100% Albariño,Enólogo: Ana I. Quintela Suárez,Bodeguero: Marisol Bueno y Javier Mareque,Tipo de botella: Troncocónica,Capacidad (cl): 75,Servicio: Degustar a una temperatura de 8º C,Graduación (% vol.): 13";1;new;0;0;0;0;0;0;0;0
