ID;Active;Name;Categories;Price;Tax;"Wholesale price";OnSale;Discount;DiscountPercent;DiscountFrom;DiscountTo;Reference;SupplierReference;Supplier;Manufacturer;Ean13;Upc;Ecotax;Width;Height;Depth;Weight;Quantity;MinimalQuantity;Visibility;AdditionalShippingCost;Unity;UnityPrice;ShortDescription;Description;Tags;Metatitle;MetaKeywords;MetaDescription;UrlRewritten;TextStock;TextBackorder;Avaiable;ProductAvaiableDate;ProductCreationDate;ShowPrice;ImageUrls;DeleteExistingImages;Feature;AvaiableOnline;Condition;Customizable;Uploadable;TextFields;OutStock;IdNameShop;AdvancedStockManagement;DependsOnStock;Warehouse
107;1;"Aro 2005";2,3;"125,00 ";31;"125,00 ";0;0;0;0;0;10435;;;;;;;;;;;50;1;both;1;;;" Muga esgrime el roble y la crianza como recetas maestras. Esta firma, símbolo del clasicismo riojano, presenta ";"Información general Aro es la última y más vanguardista apuesta de Muga, cuyo nombre homenajea a la capital del vino de Rioja: el municipio de Haro. Aro 2005 nace de viñedos de más de sesenta años, entre los cuales se han seleccionado las cepas una a una.La familia Muga dirige una de las bodegas protagonistas de Rioja.  En 1968 comienza su trayectoria en el histórico barrio de la Estación de Haro, emplazamiento de las más prestigiosas casas bodegueras de La Rioja. Fundada por Isaac Muga, esta bodega continúa después de muchos años bajo la dirección de la misma familia, cuyas nuevas generaciones se han incorporado al negocio manteniéndolo ineludiblemente unido al apellido Muga. Pero esta bodega es mucho más que un emblema de tradición familiar. Muga ha alcanzado prestigio y fama mundial por la excelencia de sus vinos, apostando por el roble como receta maestra.";Aro-2005;Aro-2005;Aro-2005;Aro-2005;;;;1;;;1;http://www.vinoseleccion.com/media/catalog/product/cache/1/image/220x445/9df78eab33525d08d6e5fb8d27136e95/a/r/aro-tinto-con-crianza-2006-001.jpg;;"Tipo de Vino: Blanco,Bodega: Pazo de Señorans,Regiones: D.O. Rías Baixas,Variedad de Uva: 100% Albariño,Enólogo: Ana I. Quintela Suárez,Bodeguero: Marisol Bueno y Javier Mareque,Tipo de botella: Troncocónica,Capacidad (cl): 75,Servicio: Degustar a una temperatura de 8º C,Graduación (% vol.): 13";1;new;0;0;0;0;0;0;0;0
108;1;"Cirsion 2009";2,3;"130,00 ";31;"130,00 ";0;0;0;0;0;10435;;;;;;;;;;;50;1;both;1;;;" Sólo los dueños de Bodegas Roda, el director general ";"Información general Cirsion 2009 es el vino más alto de la gama de Roda y también el que realiza una crianza más corta. Se elabora exclusivamente con Tempranillo y el proceso de elaboración es uno de los secretos mejor guardados de la bodega. Es un vino magnífico, completo en todos sus elementos y conceptos: frutas, minerales, balsámicos, volumen, potencia, sedosidad, persistencia y frescura.  Cirsion es una obra de arte porque Roda siempre tuvo la intención de hacer vinos muy grandes desde el principio. Roda (anteriormente conocido como Roda II) y Roda I lo fueron, así que el mejor vino de la bodega no iba a ser una excepción. La clave está en unas viñas muy viejas de Tempranillo cuyas uvas maduran de forma muy especial, lo que convierte a cada cepa en una bodega en sí misma. Por eso no se trata de un vino con una crianza muy larga, precisamente para que la madera no reste cualidades al resultado final. Cirsion es, en definitiva, un compendio único de aromas y sabores en perfecta armonía, un ejercicio perfecto de orfebrería enológica al servicio del placer.";Cirsion-2009;Cirsion-2009;Cirsion-2009;Cirsion-2009;;;;1;;;1;http://www.vinoseleccion.com/media/catalog/product/cache/1/image/220x445/9df78eab33525d08d6e5fb8d27136e95/c/i/cirsion-2009-001.png;;"Tipo de Vino: Blanco,Bodega: Pazo de Señorans,Regiones: D.O. Rías Baixas,Variedad de Uva: 100% Albariño,Enólogo: Ana I. Quintela Suárez,Bodeguero: Marisol Bueno y Javier Mareque,Tipo de botella: Troncocónica,Capacidad (cl): 75,Servicio: Degustar a una temperatura de 8º C,Graduación (% vol.): 13";1;new;0;0;0;0;0;0;0;0
109;1;"Artadi El Carretil 2010";2,3;"130,00 ";31;"130,00 ";0;0;0;0;0;10435;;;;;;;;;;;50;1;both;1;;;" Perteneciente a la nueva colección de vinos parcelarios y ecológicos de Artadi, El Carretil destaca por su complejidad y elegancia.";"Información general Artadi El Carretil 2010 es un excepcional vino de pago elaborado cien por cien con uvas de tempranillo procedentes de una finca de 5 hectáreas ubicada en el municipio Laguardia, en el corazón de Rioja Alavesa. Es un vino con una mineralidad marcada y precisa, un tanino fibroso y escultural y pródigo en sensaciones envolventes. Profundo y complejo posee una fruta muy limpia y la textura es radiante en su final de boca.  La historia de Artadi es un claro ejemplo de superación. Lo que comenzó siendo una modesta cooperativa, auspiciada en 1985 por un Juan Carlos López de Lacalle que tuvo la audacia de reunir a un grupo de viticultores en un nuevo concepto de cooperativismo, hoy es una de las bodegas enseña de la Rioja Alavesa. Sus nuevos y excelentes vinos parcelarios (El Carretil, La Poza de Ballesteros y Valdeginés) han dejado boquiabierto a más de un crítico vinícola que creía que la bodega había tocado techo con tintos como La Nieta o Pagos Viejos.";Artadi-El-Carretil-2010;Artadi-El-Carretil-2010;Artadi-El-Carretil-2010;Artadi-El-Carretil-2010;;;;1;;;1;http://www.vinoseleccion.com/media/catalog/product/cache/1/image/220x445/9df78eab33525d08d6e5fb8d27136e95/A/r/Artadi-El-Carretil-Tinto-con-crianza-2010-001_2.jpg;;"Tipo de Vino: Blanco,Bodega: Pazo de Señorans,Regiones: D.O. Rías Baixas,Variedad de Uva: 100% Albariño,Enólogo: Ana I. Quintela Suárez,Bodeguero: Marisol Bueno y Javier Mareque,Tipo de botella: Troncocónica,Capacidad (cl): 75,Servicio: Degustar a una temperatura de 8º C,Graduación (% vol.): 13";1;new;0;0;0;0;0;0;0;0
110;1;"Contino Tinto Gran Reserva 2009";2,3;"135,00 ";31;"135,00 ";0;0;0;0;0;10435;;;;;;;;;;;50;1;both;1;;;" Contino se nutre de algunos de los mejores viñedos establecidos en Rioja Alavesa para su deseada gama de vinos. Como muestra, este ";"Información generalHablar de Bodegas y Viñedos del Contino es hablar de una de las casas elaboradoras más importantes del vino español. Una firma pionera que data 1973, cuando la Compañía Vinícola del Norte de España (CVNE) decide apostar decisivamente por la combinación idónea de viñedos autóctonos, una climatología continental con una importante influencia atlántica, los suelos más aptos de Rioja Alavesa y una enología de vanguardia.Para crear este complejo entramado vitivinícola, los responsables de la mítica casa sita en el Barrio de la Estación de Haro se fijaron en un favorecido pago del término de Laserna, al pie de los romanos Puentes Mantibres y protegido por el Cerro de la Mesa. Allí, la firma riojana diseñó un moderno inmueble elaborador, donde se respetaron los viejos calados del siglo XVI de la construcción original, ideales para la crianza y sosiego de los vinos de la casa.Vinculado a CVNE desde hace más de veinte años, Jesús de Madrazo es el responsable del vino que les acercamos y del resto de vinos de Contino. Un extraordinario enólogo que se sirve de las últimas tecnologías para la elaboración al servicio de una uva de inmensa calidad, como mesas de selección para que sólo se elaboren los mejores racimos o depósitos a medida para cada parcela concreta. Con estos mimbres, tintos como Contino Gran Reserva 2009 se convierten en joyas limitadas y tremendamente deseadas. Una verdadera obra maestra que no se deben perder.";Contino-Tinto-Gran-Reserva-2009;Contino-Tinto-Gran-Reserva-2009;Contino-Tinto-Gran-Reserva-2009;Contino-Tinto-Gran-Reserva-2009;;;;1;;;1;http://www.vinoseleccion.com/media/catalog/product/cache/1/image/220x445/9df78eab33525d08d6e5fb8d27136e95/c/o/contino-tinto-gran-reserva-2009-001_1_1.jpg;;"Tipo de Vino: Blanco,Bodega: Pazo de Señorans,Regiones: D.O. Rías Baixas,Variedad de Uva: 100% Albariño,Enólogo: Ana I. Quintela Suárez,Bodeguero: Marisol Bueno y Javier Mareque,Tipo de botella: Troncocónica,Capacidad (cl): 75,Servicio: Degustar a una temperatura de 8º C,Graduación (% vol.): 13";1;new;0;0;0;0;0;0;0;0
111;1;"Aro 2009";2,3;"138,00 ";31;"138,00 ";0;0;0;0;0;10435;;;;;;;;;;;50;1;both;1;;;" ";"Información general Aliada del clasicismo durante mucho tiempo, Muga también juega su baza en la liga de los riojas modernos con Aro, su vino más exclusivo, en un estilo más potente, con más fruta y cuerpo que el resto de sus elaborados. Aro 2009 consiguió 95 puntos en la publicación de Robert Parker, el crítico más influyente del mundo. Aro es un vino top en sintonía con los gustos actuales pero elaborado con toda la sabiduría de una de las bodegas más solventes de Rioja. Elaborado con las mejores uvas de la bodega, con tempranillo y graciano (variedad que aporta acidez y una larga vida al vino). Carnoso, potente, y con un largo final de boca. Fundada en 1932, Muga es una bodega familiar ubicada en el famoso Barrio de la Estación de Haro. Con una reputada trayectoria, sus vinos  gozan de muy buena aceptación tanto en el mercado nacional e internacional (exporta entorno al 50% de su producción). Especializada en tintos con crianza, en sus instalaciones no existe el acero inoxidable; todo el protagonismo es para el roble, de hecho, es una de las pocas bodegas españolas que fabrica sus propias barricas.";Aro-2009;Aro-2009;Aro-2009;Aro-2009;;;;1;;;1;http://www.vinoseleccion.com/media/catalog/product/cache/1/image/220x445/9df78eab33525d08d6e5fb8d27136e95/a/r/aro-tinto-con-crianza-2009-001.jpg;;"Tipo de Vino: Blanco,Bodega: Pazo de Señorans,Regiones: D.O. Rías Baixas,Variedad de Uva: 100% Albariño,Enólogo: Ana I. Quintela Suárez,Bodeguero: Marisol Bueno y Javier Mareque,Tipo de botella: Troncocónica,Capacidad (cl): 75,Servicio: Degustar a una temperatura de 8º C,Graduación (% vol.): 13";1;new;0;0;0;0;0;0;0;0
112;1;"Aro 2006";2,3;"140,00 ";31;"140,00 ";0;0;0;0;0;10435;;;;;;;;;;;50;1;both;1;;;" ";"Información general Con Aro, Muga se introduce de lleno en los riojas de corte moderno y vanguardista. Aro 2006 es el resultado de una minuciosa selección de viñedos de más de sesenta años. Una obra maestra que luce mayor potencia que los habituales vinos de la bodega. Un tinto carnoso y elegante situado entre los mejores riojas del siglo XXI, y en el que se aprecia un excelente manejo de la crianza, marca de la casa. La familia Muga dirige una de las bodegas protagonistas de Rioja. En 1968 comienza su trayectoria en el histórico barrio de la Estación de Haro, emplazamiento de las más prestigiosas casas bodegueras de La Rioja. Muga es mucho más que un emblema de tradición familiar: ha alcanzado prestigio mundial por la excelencia de sus vinos, apostando por el roble como receta maestra, y uniendo sabiamente clasicismo y gustos actuales.";Aro-2006;Aro-2006;Aro-2006;Aro-2006;;;;1;;;1;http://www.vinoseleccion.com/media/catalog/product/cache/1/image/220x445/9df78eab33525d08d6e5fb8d27136e95/A/r/Aro-Tinto-con-crianza-2006-001_2.jpg;;"Tipo de Vino: Blanco,Bodega: Pazo de Señorans,Regiones: D.O. Rías Baixas,Variedad de Uva: 100% Albariño,Enólogo: Ana I. Quintela Suárez,Bodeguero: Marisol Bueno y Javier Mareque,Tipo de botella: Troncocónica,Capacidad (cl): 75,Servicio: Degustar a una temperatura de 8º C,Graduación (% vol.): 13";1;new;0;0;0;0;0;0;0;0
113;1;"Cirsion 2010";2,3;"140,00 ";31;"140,00 ";0;0;0;0;0;10435;;;;;;;;;;;50;1;both;1;;;" ";"Información general Bodegas Roda ha construido en apenas dos décadas una escuela que conjuga la esencia del vino riojano con la matemática enológica más precisa. Cirsion 2010 es la ecuación perfecta, un vino hecho para seducir y perdurar en el tiempo. Elaborado con una selección de racimos de tempranillo de diversas parcelas, en las que se ha aplicado una investigación propia sobre polimerización de taninos y antocianos. Fermenta en tinas de roble y realiza la crianza en barricas de roble francés. La Excelente cosecha 2010, que fusiona la madurez y la frescura como pocas, convertirá a este rioja en una auténtica pieza de coleccionismo. En 1995, el equipo enológico de Bodegas Roda, encabezado por Agustín Santolaya, descubrió que unas pocas cepas producían uvas con una estructura y sedosidad muy por encima de lo normal, como si el fruto hubiera pasado por un proceso de crianza. Santolaya decidió elaborar un vino sólo con esos granos excepcionales y así nació Cirsion, un tinto moderno, sutil y elegante.";Cirsion-2010;Cirsion-2010;Cirsion-2010;Cirsion-2010;;;;1;;;1;http://www.vinoseleccion.com/media/catalog/product/cache/1/image/220x445/9df78eab33525d08d6e5fb8d27136e95/c/i/cirsion-tinto-con-crianza-2010-001.jpg;;"Tipo de Vino: Blanco,Bodega: Pazo de Señorans,Regiones: D.O. Rías Baixas,Variedad de Uva: 100% Albariño,Enólogo: Ana I. Quintela Suárez,Bodeguero: Marisol Bueno y Javier Mareque,Tipo de botella: Troncocónica,Capacidad (cl): 75,Servicio: Degustar a una temperatura de 8º C,Graduación (% vol.): 13";1;new;0;0;0;0;0;0;0;0
114;1;"Aro 2010";2,3;"140,00 ";31;"140,00 ";0;0;0;0;0;10435;;;;;;;;;;;50;1;both;1;;;" ";"Información general Aro 2010 que tiene la peculiaridad de contar en su composición con un alto porcentaje de graciano (30%), que secunda a la perfección a la tempranillo que domina el coupage y le aporta es¬tructura, convirtiéndolo en un tinto que presenta una larga vida. Además de un envejecimiento de 18 meses en roble francés nuevo, a este ensamblaje de añada Excelente se le suman 6 meses de crianza en tinos.  Aliada del clasicismo durante mucho tiempo, Muga también juega su baza en la liga de los riojas modernos con Aro, su vino más exclusivo, en un estilo más potente, con más fruta y cuerpo que el resto de sus elaborados. Fundada en 1932, Muga es una bodega familiar ubicada en el famoso Barrio de la Estación de Haro. Con una reputada trayectoria, sus vinos  gozan de muy buena aceptación tanto en el mercado nacional e internacional (exporta entorno al 50% de su producción). Especializada en tintos con crianza, en sus instalaciones no existe el acero inoxidable; todo el protagonismo es para el roble, de hecho, es una de las pocas bodegas españolas que fabrica sus propias barricas.";Aro-2010;Aro-2010;Aro-2010;Aro-2010;;;;1;;;1;http://www.vinoseleccion.com/media/catalog/product/cache/1/image/220x445/9df78eab33525d08d6e5fb8d27136e95/a/r/aro-tinto-tinto-con-crianza-2010-001.jpg;;"Tipo de Vino: Blanco,Bodega: Pazo de Señorans,Regiones: D.O. Rías Baixas,Variedad de Uva: 100% Albariño,Enólogo: Ana I. Quintela Suárez,Bodeguero: Marisol Bueno y Javier Mareque,Tipo de botella: Troncocónica,Capacidad (cl): 75,Servicio: Degustar a una temperatura de 8º C,Graduación (% vol.): 13";1;new;0;0;0;0;0;0;0;0
115;1;"Viña El Pisón 2006";2,3;"175,00 ";31;"175,00 ";0;0;0;0;0;10435;;;;;;;;;;;50;1;both;1;;;" El gurú vinícola Robert Parker encumbró Viña El Pisón otorgando a la añada 2004 los codiciados 100 puntos en su prestigiosa lista, la máxima distinción que puede alcanzar un vino a nivel mundial. Con este excepcional logro, la fama de su autor, Juan Carlos López de Lacalle ha sobrepasado las fronteras nacionales.";"Información general Juan Carlos López de Lacalle marcó tendencia en la Rioja de los noventa, volviendo las miradas hacia el viñedo y el terroir. Hablamos de una de las figuras más influyentes del vino español, aupado a figura internacional tras alcanzar los 100 puntos Parker con Viña el Pisón 2004. Un vino que año tras año se revaloriza dentro y fuera de nuestras fronteras, muy difícil de adquirir.
Viña el Pisón sigue dando muestras de una rotunda excelencia. Un vino único, fiel expresión del pago del que procede (El Pisón, con más de 50 años de edad). Por algo está considerado como uno de los mejores tintos del mundo.";Viña-El-Pisón-2006;Viña-El-Pisón-2006;Viña-El-Pisón-2006;Viña-El-Pisón-2006;;;;1;;;1;http://www.vinoseleccion.com/media/catalog/product/cache/1/image/220x445/9df78eab33525d08d6e5fb8d27136e95/V/i/Vi_a-El-Pis_n-Tinto-con-crianza-2006-001_2.jpg;;"Tipo de Vino: Blanco,Bodega: Pazo de Señorans,Regiones: D.O. Rías Baixas,Variedad de Uva: 100% Albariño,Enólogo: Ana I. Quintela Suárez,Bodeguero: Marisol Bueno y Javier Mareque,Tipo de botella: Troncocónica,Capacidad (cl): 75,Servicio: Degustar a una temperatura de 8º C,Graduación (% vol.): 13";1;new;0;0;0;0;0;0;0;0
116;1;"Contador 2009";2,3;"220,00 ";31;"220,00 ";0;0;0;0;0;10435;;;;;;;;;;;50;1;both;1;;;" ";"Información generalEl nombre de Contador viene de la estancia que había en las antiguas cuevas de elaboración y crianza, excavadas en las laderas de los montes riojanos entre los siglos XII y XVI, donde se contaban los pellejos de vino elaborado en las bodegas del pueblo. Una de estas cuevas la cueva del Contador fue comprada por Benjamín Romeo en 1995, cuando ya tenía muy claro su aspiración de elaborar un vino propio, a su estilo, fiel reflejo de los viñedos de la zona que tan bien conocía. El proyecto de la Bodega Contador nació con el objetivo de elaborar vinos que representaran la máxima expresión de la tierra de Benjamín Romeo, San Vicente de la Sonsierra, enólogo en Artadi hasta el año 2000. Su reto era trasladar a la copa los colores, aromas, sabores, texturas e incluso sonidos de estas tierras, para que quien los deguste, allá donde esté, los sienta y se reconforte, trasladándose con su imaginación hasta los paisajes que los vieron nacer. No cabe duda que con Contador 2009, heredero de aquellas dos añadas míticas, lo ha vuelto a lograr.";Contador-2009;Contador-2009;Contador-2009;Contador-2009;;;;1;;;1;http://www.vinoseleccion.com/media/catalog/product/cache/1/image/220x445/9df78eab33525d08d6e5fb8d27136e95/C/o/Contador-tinto-con-crianza-2009-001_2.jpg;;"Tipo de Vino: Blanco,Bodega: Pazo de Señorans,Regiones: D.O. Rías Baixas,Variedad de Uva: 100% Albariño,Enólogo: Ana I. Quintela Suárez,Bodeguero: Marisol Bueno y Javier Mareque,Tipo de botella: Troncocónica,Capacidad (cl): 75,Servicio: Degustar a una temperatura de 8º C,Graduación (% vol.): 13";1;new;0;0;0;0;0;0;0;0
117;1;"Viña el Pisón 2009";2,3;"230,00 ";31;"230,00 ";0;0;0;0;0;10435;;;;;;;;;;;50;1;both;1;;;" El gran vino de ";"Información general Viña El Pisón 2009 procede del pago del mismo nombre, un viñedo familiar de 2,4 hectáreas, plantado, en 1945  por el abuelo de Juan Carlos López de Lacalle, Jenaro San Pedro Carrera y enclavado en una pequeña depresión, protegida con una barrera natural de piedra y asentado sobre una roca caliza y arenisca. Sus especiales características edafológicas, con un suelo de fuerte estructura y composición pobre, de tierra arcillo-calcárea, permiten un desarrollo contenido del viñedo con una ajustada regulación hídrica y mineral durante todo el ciclo vegetativo. De aquí nace Viña El Pisón, un vino reflejo del saber hacer de sus antepasados y de la pasión de quienes buscan mantener vivo el espíritu propio de un viñedo. El equilibrio entre los agentes naturales que configuran su entorno produce un vino lleno de sutiles caracteres minerales, finas frutas, complejas y delicadas secuencias especiadas y taninos con volúmenes envolventes y acariciantes. Es un vino con una sorprendente expresividad, lleno de carácter y personalidad. Elegancia natural con profundas y cambiantes sensaciones. La historia de Artadi es un claro ejemplo de superación. Lo que comenzó siendo una modesta cooperativa, auspiciada en 1985por un Juan Carlos López de Lacalle que tuvo la audacia de reunir a un grupo de viticultores en un nuevo concepto de cooperativismo, hoy es una de las bodegas enseña de la Rioja Alavesa. Sus vinos, como este Viña El Pisón, compiten en calidad, sin ningún tipo de complejos, con cualquiera de los grandes tintos del mundo (la añada 2004 obtuvo 100 puntos Parker).";Viña-el-Pisón-2009;Viña-el-Pisón-2009;Viña-el-Pisón-2009;Viña-el-Pisón-2009;;;;1;;;1;http://www.vinoseleccion.com/media/catalog/product/cache/1/image/220x445/9df78eab33525d08d6e5fb8d27136e95/v/i/vi_a-el-pison-tinto-con-crianza-2009-001_2.jpg;;"Tipo de Vino: Blanco,Bodega: Pazo de Señorans,Regiones: D.O. Rías Baixas,Variedad de Uva: 100% Albariño,Enólogo: Ana I. Quintela Suárez,Bodeguero: Marisol Bueno y Javier Mareque,Tipo de botella: Troncocónica,Capacidad (cl): 75,Servicio: Degustar a una temperatura de 8º C,Graduación (% vol.): 13";1;new;0;0;0;0;0;0;0;0
118;1;"Finca Resalso 2015";2,4;"7,75 ";31;"7,75 ";0;0;0;0;0;10435;;;;;;;;;;;50;1;both;1;;;"Los vinos de Emilio Moro están entre las referencias imprescindibles de Ribera del Duero y gozan de prestigio internacional. Finca Resalso 2015 es una demostración del potencial de la tinto fino (tempranillo) cuando se cultiva en viñedos especiales.";"Información generalEmilio Moro es una bodega familiar ubicada en el privilegiado entorno de Pesquera de Duero y ligada a varias generaciones de viticultores, ha realizado un excelente trabajo de selección clonal de tinto fino (tempranillo) para contar con los mejores frutos de la D.O. Ribera del Duero. Finca Resalso es un viñedo muy especial plantado en 1932, el año en el que nació Emilio Moro. Con sus uvas de tinto fino (tempranillo) se elabora Finca Resalso 2015. Bodegas Emilio Moro, fundada en 1987, está entre las firmas responsables de que la Ribera del Duero esté hoy considerada como una de las regiones vitivinícolas más importantes del mundo. Sus responsables, José y Javier Moro, representan a la tercera generación de una notable familia de viticultores. Juntos han creado algunos de los mejores vinos de nuestro país y entre ellos destaca la gama Malleolus con su Sanchomartín a la cabeza.  Finca Resalso 2015 es un Ribera del Duero carnoso y potente, que debe su elegancia a una corta pero delicada crianza en barricas de roble de la mejor calidad.";Finca-Resalso-2015;Finca-Resalso-2015;Finca-Resalso-2015;Finca-Resalso-2015;;;;1;;;1;http://www.vinoseleccion.com/media/catalog/product/cache/1/image/220x445/9df78eab33525d08d6e5fb8d27136e95/f/i/finca-resalso-tinto-con-crianza-2015-001.jpg;;"Tipo de Vino: Blanco,Bodega: Pazo de Señorans,Regiones: D.O. Rías Baixas,Variedad de Uva: 100% Albariño,Enólogo: Ana I. Quintela Suárez,Bodeguero: Marisol Bueno y Javier Mareque,Tipo de botella: Troncocónica,Capacidad (cl): 75,Servicio: Degustar a una temperatura de 8º C,Graduación (% vol.): 13";1;new;0;0;0;0;0;0;0;0
119;1;"Austum 2014";2,4;"8,00 ";31;"8,00 ";0;0;0;0;0;10435;;;;;;;;;;;50;1;both;1;;;"Disfruten de un tinto de Ribera del Duero soberbio: Austum 2014, con la firma de una de las sagas más importantes del vino español: los Raventós. Magnífico equilibrio fruta-roble.";"Información generalTionio es la bodega ribereña de la ilustre familia Raventós, una saga que vive con intensidad su pasión por el vino. Propietaria también de Bodegas Parxet, Raventós d’Alella y Basagoiti, entre otras, su historia vinculada a la elaboración vinícola se remonta a cinco siglos atrás. Austum 2014 es el resultado de su acertado desembarco en la D.O. Ribera del Duero.Austum 2014 (D.O. Ribera del Duero) se ha elaborado exclusivamente a partir de frutos de tinta fina -tempranillo- perfeccionados con una crianza de 6 meses en barricas de roble americano y francés de Allier de menos de tres años.La bodega Tionio está ubicada en los márgenes del Alto Duero y sigue la misma filosofía que el resto de bodegas de la familia Raventós: producir vinos únicos que ofrezcan la mejor expresión de cada terruño y cosecha. Tionio cuenta con un viñedo emblemático, finca Asperilla, en Peñafiel (Valladolid). Austum 2014 es ideal para acompañar platos de cuchara como una fabada o lentejas estofadas. También un asado o lechazo.";Austum-2014;Austum-2014;Austum-2014;Austum-2014;;;;1;;;1;http://www.vinoseleccion.com/media/catalog/product/cache/1/image/220x445/9df78eab33525d08d6e5fb8d27136e95/a/u/austum-tinto-con-crianza-2014-001.jpg;;"Tipo de Vino: Blanco,Bodega: Pazo de Señorans,Regiones: D.O. Rías Baixas,Variedad de Uva: 100% Albariño,Enólogo: Ana I. Quintela Suárez,Bodeguero: Marisol Bueno y Javier Mareque,Tipo de botella: Troncocónica,Capacidad (cl): 75,Servicio: Degustar a una temperatura de 8º C,Graduación (% vol.): 13";1;new;0;0;0;0;0;0;0;0
